{"$id":"urn:spicyregs:schema:document-release-v3:build-receipt:1.0","$schema":"https://json-schema.org/draft/2020-12/schema","additionalProperties":false,"properties":{"completedAt":{"type":"string"},"configurationIdentity":{"type":"string"},"conformanceClass":{"const":"DocumentRelease Producer"},"counts":{"type":"object"},"coverage":{"type":"object"},"failureTotal":{"minimum":0,"type":"integer"},"implementation":{"type":"object"},"inputIdentities":{"type":"array"},"outputIdentities":{"type":"array"},"retryTotal":{"minimum":0,"type":"integer"},"specificationVersion":{"const":"2026-08-04"},"startedAt":{"type":"string"},"verdict":{"enum":["pass","fail"]},"verificationCode":{"type":"string"},"verifier":{"type":"object"}},"required":["conformanceClass","specificationVersion","implementation","configurationIdentity","inputIdentities","outputIdentities","counts","coverage","failureTotal","retryTotal","startedAt","completedAt","verifier","verdict","verificationCode"],"type":"object"}