{"completedAt":"2026-08-04T01:00:01Z","configurationIdentity":"urn:spicy-regs:document-release-v3-config:072b6358839a7b2c2b3b35f05fc3a2b28b45329c9347e8c44d7b9c08ba485834","conformanceClass":"DocumentRelease Producer","counts":{"acceptedTerminalFailureCount":0,"activeDocumentCount":4,"deletedDocumentCount":1,"documentVersionCount":4,"eligibilityEvidenceCount":4,"excludedDocumentCount":0,"failureRecordCount":0,"memberCount":24,"partitionManifestCount":1,"passageCount":4,"previousActiveDocumentCount":4,"reconciliationUniverseCount":5,"renditionCount":4,"selectedDocumentCount":4,"sourceDispositionCount":5,"totalMemberByteSize":52088},"coverage":{"eligibleActiveDocumentCount":3,"ineligibleActiveDocumentCount":0,"normalizedTextUtf8ByteCount":580,"passageTextUtf8ByteCount":580,"renditionByteCount":580,"sourceCount":1,"unverifiedActiveDocumentCount":1},"failureTotal":0,"implementation":{"implementationId":"spicyregs.document-release-v3.reference","implementationVersion":"1.0","runtimeProfileId":"fixture-local-python-3.12"},"inputIdentities":[{"selectionId":"spicyregs.fixture-selection.incremental-mixed.v1","selectorDigest":"14448082533dc4d8dc02a60b401d1bcebf9fa0da0684eb2c6f9cfd84bd6ceb46"},{"artifactDigest":"23d975ee516a24fcf8a4ce5056cfc307ee06461099b577f97a8bb533dddcd34a","releaseId":"urn:spicy-regs:document-release:v3:23d975ee516a24fcf8a4ce5056cfc307ee06461099b577f97a8bb533dddcd34a"}],"outputIdentities":[{"manifestId":"partition:fixture","sha256":"f3af235c36f3fb64e9fe2a552c3a09effa652143ab17c8a5a5f2e42bbebd7eb9"}],"retryTotal":0,"specificationVersion":"2026-08-04","startedAt":"2026-08-04T01:00:00Z","verdict":"pass","verificationCode":"valid","verifier":{"implementationId":"spicyregs-document-release-v3-verify","version":"1.0"}}